Vendor Name,Specialization,Projects Completed
TechVision Security,AI-powered surveillance, facial recognition, object detection,"Developed AI surveillance system for national border control and prison facilities"
AutoMach Industries,Autonomous industrial machines, smart manufacturing,"Built autonomous robotic arms for electronics manufacturing plant"
CyberEdge Solutions,Cybersecurity, penetration testing, zero-trust architecture,"Implemented zero-trust network for a national defense agency"
SkyNet Drones,Drone systems, aerial monitoring, real-time analytics,"Deployed autonomous drones for oil pipeline surveillance"
DataSynth Analytics,Big Data analytics, predictive modeling, AI dashboards,"Developed predictive maintenance system for a utility company"
NeuroBotics Lab,AI-powered robotics, healthcare automation,"Built AI robotic assistant for hospital logistics and patient interaction"
SmartCity Innovations,IoT systems, smart city infrastructure,"Designed and implemented smart traffic system in major metropolitan area"
BioScan Tech,Biometrics, facial/iris/fingerprint recognition,"Deployed multi-modal biometric authentication for government ID program"
GreenVolt Energy,Renewable energy systems, smart grid integration,"Built smart solar grid monitoring system for remote areas"
SecureCom Networks,Next-gen communication infrastructure, secure data channels,"Set up encrypted communication network for military use"

